{"edges":[[0,6],[1,43],[1,159],[2,24],[3,21],[3,37],[3,52],[3,71],[3,85],[3,133],[3,158],[4,22],[4,130],[5,180],[6,8],[6,14],[6,17],[6,19],[6,20],[6,23],[6,24],[6,28],[6,29],[6,31],[6,32],[6,33],[6,37],[6,39],[6,48],[6,52],[6,57],[6,61],[6,69],[6,78],[6,79],[6,80],[6,84],[6,88],[6,89],[6,90],[6,92],[6,94],[6,96],[6,97],[6,98],[6,102],[6,103],[6,109],[6,114],[6,115],[6,119],[6,120],[6,123],[6,132],[6,136],[6,142],[6,146],[6,156],[6,159],[6,167],[6,168],[6,173],[6,174],[6,179],[6,185],[6,186],[6,187],[6,188],[6,189],[6,190],[6,191],[6,192],[6,193],[6,196],[7,96],[8,32],[10,37],[10,114],[11,15],[11,37],[11,114],[11,140],[11,181],[12,37],[12,90],[12,125],[12,128],[12,171],[13,23],[13,24],[13,164],[14,17],[14,92],[14,98],[15,114],[15,140],[15,141],[15,181],[16,32],[16,156],[17,92],[18,46],[18,62],[18,63],[18,64],[18,90],[18,125],[19,98],[19,187],[19,196],[20,32],[20,33],[20,73],[20,146],[20,168],[20,186],[21,37],[21,52],[21,71],[21,85],[21,133],[21,158],[21,174],[22,130],[23,24],[23,27],[23,32],[23,36],[23,37],[23,80],[23,93],[23,100],[23,114],[23,159],[23,164],[23,187],[23,192],[23,196],[24,32],[24,37],[24,70],[24,114],[24,159],[24,164],[24,182],[24,187],[24,192],[24,196],[24,199],[25,76],[25,126],[26,47],[26,159],[26,192],[28,79],[28,123],[28,188],[29,92],[30,54],[30,114],[31,94],[31,104],[31,113],[31,142],[31,187],[31,196],[32,33],[32,37],[32,39],[32,48],[32,66],[32,69],[32,73],[32,79],[32,89],[32,90],[32,96],[32,97],[32,98],[32,109],[32,114],[32,115],[32,120],[32,123],[32,146],[32,147],[32,156],[32,159],[32,168],[32,173],[32,179],[32,186],[32,187],[32,188],[32,191],[32,192],[32,196],[33,89],[33,96],[33,146],[33,186],[34,37],[34,197],[35,37],[35,108],[35,120],[36,159],[37,41],[37,46],[37,52],[37,53],[37,54],[37,59],[37,63],[37,64],[37,65],[37,67],[37,71],[37,74],[37,85],[37,86],[37,90],[37,91],[37,96],[37,98],[37,99],[37,101],[37,114],[37,117],[37,118],[37,120],[37,121],[37,125],[37,126],[37,128],[37,129],[37,133],[37,135],[37,146],[37,148],[37,150],[37,155],[37,158],[37,159],[37,160],[37,162],[37,163],[37,169],[37,170],[37,174],[37,176],[37,179],[37,184],[37,185],[37,186],[37,187],[37,192],[37,194],[37,195],[37,196],[37,197],[39,96],[39,120],[39,173],[40,45],[40,49],[40,50],[40,74],[40,99],[40,106],[40,114],[40,117],[42,55],[42,114],[42,143],[42,185],[43,159],[45,74],[45,106],[45,114],[45,117],[46,62],[46,63],[46,64],[46,90],[46,114],[46,118],[46,125],[46,128],[46,151],[46,154],[46,170],[47,159],[47,192],[48,69],[48,79],[48,115],[48,188],[49,74],[49,106],[49,114],[50,74],[50,81],[50,114],[51,87],[51,165],[52,90],[52,114],[52,133],[52,135],[52,150],[52,158],[52,174],[52,176],[53,148],[53,174],[54,114],[55,114],[55,143],[55,185],[56,65],[57,88],[57,98],[57,132],[57,187],[57,196],[59,194],[60,65],[61,98],[61,102],[61,187],[61,189],[61,196],[62,63],[62,64],[62,90],[63,64],[63,90],[63,118],[63,125],[63,128],[63,170],[64,90],[64,125],[65,126],[66,96],[66,146],[66,179],[66,186],[67,86],[67,114],[67,160],[67,174],[68,194],[69,79],[69,115],[69,188],[71,85],[71,91],[71,101],[71,133],[71,158],[72,114],[73,146],[73,186],[74,81],[74,99],[74,106],[74,114],[74,117],[75,122],[75,190],[76,126],[78,98],[78,187],[78,196],[79,98],[79,115],[79,123],[79,186],[79,187],[79,188],[79,196],[80,159],[80,192],[81,114],[82,137],[82,183],[83,114],[83,163],[84,102],[84,103],[84,187],[84,189],[84,196],[85,133],[86,160],[87,165],[88,98],[88,132],[88,187],[88,196],[89,96],[89,146],[89,179],[89,186],[90,114],[90,118],[90,120],[90,125],[90,126],[90,128],[90,151],[90,154],[90,170],[90,171],[91,101],[91,158],[92,98],[94,104],[94,113],[94,142],[94,187],[94,196],[95,120],[95,145],[96,98],[96,114],[96,116],[96,120],[96,124],[96,146],[96,147],[96,173],[96,175],[96,179],[96,186],[96,187],[96,196],[96,198],[97,109],[98,102],[98,103],[98,114],[98,119],[98,120],[98,132],[98,136],[98,159],[98,167],[98,186],[98,187],[98,189],[98,192],[98,196],[99,114],[99,117],[99,149],[99,166],[101,158],[102,103],[102,119],[102,187],[102,189],[102,196],[103,119],[103,187],[103,189],[103,196],[104,113],[104,142],[105,114],[105,131],[105,185],[106,114],[107,114],[108,120],[108,139],[108,152],[110,112],[111,114],[111,117],[112,114],[113,142],[114,117],[114,120],[114,131],[114,141],[114,149],[114,159],[114,160],[114,163],[114,166],[114,174],[114,185],[114,186],[114,187],[114,192],[114,194],[114,196],[115,188],[116,124],[116,147],[116,179],[116,198],[117,166],[118,170],[119,187],[119,189],[119,196],[120,127],[120,145],[120,146],[120,172],[120,173],[120,175],[120,179],[120,186],[120,187],[120,196],[122,190],[123,188],[124,179],[124,198],[125,128],[125,151],[125,154],[128,154],[128,171],[129,155],[129,158],[129,169],[132,187],[132,196],[133,158],[134,147],[134,179],[135,174],[136,187],[136,196],[137,183],[138,185],[139,152],[140,141],[140,181],[142,196],[143,185],[146,168],[146,179],[146,186],[146,187],[147,179],[148,174],[149,166],[150,174],[151,154],[156,186],[157,185],[158,169],[159,187],[159,192],[159,196],[163,185],[168,186],[174,184],[179,186],[179,198],[186,187],[186,196],[187,189],[187,190],[187,192],[187,193],[187,196],[189,196],[190,192],[190,196],[192,196],[193,196],[195,197]],"model":{"R":10.504399538733493,"T":0,"gamma":2.5,"kbar":6,"n":200,"seed":7,"zeta":1},"nodes":[{"degree":1,"id":0,"label":"AS-0","r":9.878537199772598,"theta":5.0993540444304255},{"degree":2,"id":1,"label":"AS-1","r":10.359900440994918,"theta":4.134499807723751},{"degree":1,"id":2,"label":"AS-2","r":10.166014379374323,"theta":3.8374603625152974},{"degree":7,"id":3,"label":"AS-3","r":8.520221432922318,"theta":1.201676029468145},{"degree":2,"id":4,"label":"AS-4","r":8.902192891055025,"theta":3.609028642774564},{"degree":1,"id":5,"label":"AS-5","r":10.324297762808,"theta":0.24935712135616955},{"degree":61,"id":6,"label":"AS-6","r":3.681988003022265,"theta":5.037006011362123},{"degree":1,"id":7,"label":"AS-7","r":10.242014048698074,"theta":6.032303479709301},{"degree":2,"id":8,"label":"AS-8","r":10.202238643493759,"theta":5.365897249253165},{"degree":0,"id":9,"label":"AS-9","r":9.492979190163167,"theta":0.3186181024662343},{"degree":2,"id":10,"label":"AS-10","r":8.914832104094938,"theta":2.1278640600228025},{"degree":5,"id":11,"label":"AS-11","r":8.802207308757508,"theta":1.9980730204444148},{"degree":5,"id":12,"label":"AS-12","r":8.684676280759577,"theta":0.7082217462626197},{"degree":3,"id":13,"label":"AS-13","r":9.426311815881515,"theta":3.9371181765075196},{"degree":4,"id":14,"label":"AS-14","r":9.593268350510703,"theta":5.010577490551987},{"degree":5,"id":15,"label":"AS-15","r":9.716549475543504,"theta":1.9711701434312505},{"degree":2,"id":16,"label":"AS-16","r":10.4983909427594,"theta":5.421190307740254},{"degree":3,"id":17,"label":"AS-17","r":10.194852369238538,"theta":5.008496106752225},{"degree":6,"id":18,"label":"AS-18","r":9.872309856593718,"theta":0.8113976164708948},{"degree":4,"id":19,"label":"AS-19","r":10.489609154564215,"theta":4.818318186293305},{"degree":7,"id":20,"label":"AS-20","r":8.46049608616786,"theta":5.545669539100002},{"degree":8,"id":21,"label":"AS-21","r":8.06800158628194,"theta":1.2395629441294604},{"degree":2,"id":22,"label":"AS-22","r":9.851515915890998,"theta":3.604293830618288},{"degree":16,"id":23,"label":"AS-23","r":6.359594049314306,"theta":4.013384401471536},{"degree":15,"id":24,"label":"AS-24","r":6.08707602994669,"theta":3.828560053838686},{"degree":2,"id":25,"label":"AS-25","r":9.620278196905828,"theta":0.6047294275520658},{"degree":3,"id":26,"label":"AS-26","r":9.488051656288851,"theta":4.154388473081733},{"degree":1,"id":27,"label":"AS-27","r":10.389204259954411,"theta":3.970688640909072},{"degree":4,"id":28,"label":"AS-28","r":9.887308616799391,"theta":5.176625199295925},{"degree":2,"id":29,"label":"AS-29","r":9.618282641745127,"theta":5.04861918530789},{"degree":2,"id":30,"label":"AS-30","r":9.572861693340077,"theta":2.0556584770587376},{"degree":7,"id":31,"label":"AS-31","r":8.645752133085251,"theta":4.53675719333233},{"degree":37,"id":32,"label":"AS-32","r":4.665041289623468,"theta":5.449239406102493},{"degree":7,"id":33,"label":"AS-33","r":8.311071905627093,"theta":5.610556234343319},{"degree":2,"id":34,"label":"AS-34","r":10.014018332468751,"theta":1.014811879601771},{"degree":3,"id":35,"label":"AS-35","r":8.366536496223842,"theta":0.16777581372930916},{"degree":2,"id":36,"label":"AS-36","r":9.178779251699607,"theta":4.089143766313657},{"degree":65,"id":37,"label":"AS-37","r":3.2866813963021038,"theta":1.3488508027036912},{"degree":0,"id":38,"label":"AS-38","r":10.256243537622305,"theta":3.541892657029105},{"degree":5,"id":39,"label":"AS-39","r":8.019493558750836,"theta":5.936381939839061},{"degree":8,"id":40,"label":"AS-40","r":8.749473363231148,"theta":2.3833354898286148},{"degree":1,"id":41,"label":"AS-41","r":10.334595489595143,"theta":1.5882293410036021},{"degree":4,"id":42,"label":"AS-42","r":9.607030418405973,"theta":2.868337238500237},{"degree":2,"id":43,"label":"AS-43","r":10.283412126350528,"theta":4.129585299095888},{"degree":0,"id":44,"label":"AS-44","r":9.909329318483676,"theta":0.6352235493954133},{"degree":5,"id":45,"label":"AS-45","r":10.106464686984218,"theta":2.3912845941630274},{"degree":13,"id":46,"label":"AS-46","r":7.325752669433449,"theta":0.8401950089687926},{"degree":3,"id":47,"label":"AS-47","r":9.686495249800604,"theta":4.162272366443312},{"degree":6,"id":48,"label":"AS-48","r":9.601748323356668,"theta":5.218515467556837},{"degree":4,"id":49,"label":"AS-49","r":10.320917004358789,"theta":2.3678421423027296},{"degree":4,"id":50,"label":"AS-50","r":9.148655244685957,"theta":2.335610478398943},{"degree":2,"id":51,"label":"AS-51","r":9.81993533659895,"theta":3.3899145604036764},{"degree":12,"id":52,"label":"AS-52","r":6.75234303276244,"theta":1.3512478812167348},{"degree":3,"id":53,"label":"AS-53","r":9.242394462359263,"theta":1.5545203109017967},{"degree":3,"id":54,"label":"AS-54","r":8.999859600253476,"theta":2.072523019859703},{"degree":4,"id":55,"label":"AS-55","r":7.982376266108325,"theta":2.8740904256684123},{"degree":1,"id